company_name,linkedin_url,description,company_name_norm,fleet_size
beOnd,https://linkedin.com/company/flybeond,beOnd is the World's First Premium Leisure Airline. Our vision is to take people on their journey to the best places on Earth. So travel with us and fly above ...,beond,
Bering Air,https://linkedin.com/company/bering-marine-corp,"Bering Marine Corporation provides highly specialized, contracted marine services to reach water-locked villages and other remote Alaska locations.",bering air,
BermudAir,https://linkedin.com/company/flybermudair,"BermudAir is a boutique airline that offers corporate and leisure travellers short, nonstop flights between Bermuda, the East Coast US, South Florida, Toronto, ...",bermudair,
Berniq Airways,https://linkedin.com/company/berniq-airways/,شركة طيران ليبية مساهمة تأسست عام 2018 برأس مال 500 مليون دينار ليبي. Website: https://berniq.aero. External link for Berniq Airways.,berniq airways,
Berry Aviation,https://linkedin.com/company/berry-aviation-inc,"Berry Aviation, Inc. (BAI), a member of Acorn Growth Companies, is an FAA Part 135 Air Carrier established in 1983.",berry aviation,
Bestfly Aruba,https://linkedin.com/company/bestfly,BESTFLY. Fabricação de aeronaves. http://www.bestfly.aero/. Seguir · Denunciar esta empresa; Close menu. Visualizar todos os 235 funcionários. Sobre nós.,bestfly aruba,
Bhutan Airlines,https://linkedin.com/company/bhutan-airlines---thailand,Fly with us to the land of happiness! บริษัท โอ เอ็ม จี เอ็กซ์พีเรียนซ์ (ภูฏานแอร์ไลน์ ประเทศไทย - Bhutan Airlines Thailand) ตัวแทนจำหน่ายบัตรโดยสาร สายการบินภูฏาน และ แหล่ง ...,bhutan airlines,
Biman Bangladesh Airlines,https://linkedin.com/company/biman-bangladesh-airlines,"Biman Bangladesh Airlines Ltd the national flag carrier of Bangladesh has started its journey from scratch virtually with no aircraft, no ancilliaries.",biman bangladesh airlines,
BinAir,https://linkedin.com/company/binair-aero-service-gmbh,"Since 1996 BinAir is the airline which focuses on you spezial requirements, every day, worldwide and tghe flexibility of Europe´s largest Metro Fleet of 15 ...",binair,
Binter Canarias,https://linkedin.com/company/binter-canarias,"BinterCanarias nació como compañía aérea regional, y en ese sentido es la única que opera actualmente en los ocho aeropuertos de Canarias. Desde el año 2005 ...",binter canarias,
Bioflight,https://linkedin.com/company/bioflight-a-s,BioFlight is an Aircraft Operator that has specialised in “Special missions” and Aerial Data Acquisition. Though our idealistic and ambitious approach to ...,bioflight,
Blue Dart Aviation,https://linkedin.com/company/blue-dart-aviation-limited,Blue Dart is a leader in the domestic air express market specializing in time-definite scheduled freight services for overnight next day delivery.,blue dart aviation,
Blue Islands,https://linkedin.com/company/blue-islands,"Blue Islands is a privately and independently owned Channel Islands based regional airline, operating flights between the Channel Islands and to the UK.",blue islands,
Bluebird Airways,https://linkedin.com/company/bluebird-airways,"Blue bird airways is a greek airline company, established on 2008. With a rapid growth and superior customer service. We shoot for the sky when it comes to top ...",bluebird airways,
Boeing,https://linkedin.com/company/boeing,"As a leading global aerospace company, Boeing develops, manufactures and services commercial airplanes, defense products and space systems for customers in ...",boeing,
Boliviana de Aviacion,https://linkedin.com/company/boliviana-de-aviac%C3%B3n,Boliviana de Aviación | 30945 followers on LinkedIn. Bolivian's Airline | VISION «Boliviana de Aviación will contribute significantly to the achievement of ...,boliviana de aviacion,
Boutique Air,https://linkedin.com/company/boutique-air,"A boutique airline and charter service company serving passengers in the United States, Mexico, and Canada. We help people get around in style.",boutique air,
BRA,https://linkedin.com/company/the-sports-bra,"Founded in April 2022, The Sports Bra in Portland, Ore., is the world's first sports bar to only show women's sports.",bra,
Bravo Airways,https://linkedin.com/company/bravo-airways,Bravo Airways is an airlines company based in Ukraine. Website: http://www.bravoairways.com.ua/. External link for Bravo Airways. Industry: Aviation ...,bravo airways,
Brazil - Air Force,https://linkedin.com/company/brazil-defense-brief-bdb,"Brazil Defense Brief (BDB) is the go-to intelligence and monitoring service for decision-makers navigating the complexities of Brazil's Aerospace, Defense, ...",brazil - air force,
Bristow Helicopters,https://linkedin.com/company/bristow-group-inc,"Bristow is the world's leading provider of offshore oil and gas transportation, search and rescue (SAR) and aircraft support services to government and civil ...",bristow helicopters,
British Airways,https://linkedin.com/company/british-airways,"As a global airline and the UK's flag carrier, British Airways has been flying its customers to where they need to be for more than 100 years.",british airways,
Brussels Airlines,https://linkedin.com/company/brussels-airlines,Brussels Airlines is the home carrier of Belgium and one of the four network airlines of the Lufthansa Group. It connects the European capital from Brussels ...,brussels airlines,
Buddha Air,https://linkedin.com/company/buddha-air,Buddha Air is the leading domestic airlines of Nepal. We currently fly to 15 domestic and international destinations. We are the largest and longest operating ...,buddha air,
Buffalo Airways,https://linkedin.com/company/buffaloairways,"Buffalo Airways Ltd. is an Airlines/Aviation company located in 1000 Buffalo Drive, Hay River, NT, Canada.",buffalo airways,
Bul Air,https://linkedin.com/company/bul-air,"A privately-owned company to provide the best in class quality, safety and comfort on charter services.",bul air,
Bulgaria Air,https://linkedin.com/company/bulgaria-air,Bulgaria Air is the National air carrier of Republic of Bulgaria based at Sofia Airport /SOF/. The airline also operates scheduled and charter flights from ...,bulgaria air,
Buraq Air,https://linkedin.com/company/buraq-air-transport,"Industry: Airlines and Aviation ; Company size: 51-200 employees ; Headquarters: Tripoli, Tripoli ...",buraq air,
Business Wings,https://linkedin.com/company/business-wings,Business Wings. Авиационная и авиакосмическая промышленность. Отслеживать · Пожаловаться на эту компанию; Закрыть меню.,business wings,
Buzz,https://linkedin.com/company/buzz-air-inc.,"Buzz Airlines is a low cost, on-demand charter airline, specializing in the carriage of passengers, freight, cargo and more. Our goal is to provide affordable ...",buzz,
CAA,https://linkedin.com/company/civil-aviation-authority,We are the UK's aviation and aerospace regulator. We strive to ensure the aviation industry meets the highest safety standards in order to protect air ...,caa,
CAE,https://linkedin.com/company/caemuhendislik,CAE Engineering is your solution-oriented business partner with its wide product portfolio provided by its international distribution in the electricity ...,cae,
Caicos Express Airways,https://linkedin.com/company/caicos-express-airways,"Caicos Express Airways | 151 followers on LinkedIn. Turks and Caicos-based airline connecting TCI, Haiti, Dominican Republic, and Jamaica since 2007 | Turks ...",caicos express airways,
Calm Air,https://linkedin.com/company/calmair,"Calm Air International is a niche airline serving the northern part of Central Canada. From its main bases at Winnipeg, Thompson and Churchill, Manitoba, ...",calm air,
Calstar,https://linkedin.com/company/calstar-benefits,"Since 1983, CALSTAR has been saving lives throughout Northern and Central California. We have flown over 40,000 patients quickly and safely.",calstar,
Camair-Co,https://linkedin.com/company/camair-co,"Based in Douala, Camair-Co prides its self as National Airline Company of Cameroon and aspires to change the landscape of the air transport in Cameroon, in ...",camair-co,
Cambodia Airways,https://linkedin.com/company/cambodia-airways,"Cambodia Airways Co., Ltd. is a local Cambodian airline based in Phnom Penh. Established in September 2017, the company launched its inaugural flight on July ...",cambodia airways,
CAMEX Airlines,https://linkedin.com/company/camex-airlines,CAMEX Airlines is a charter airline with the ability to reach across the globe even on short notice. With thousands of hours of airline and cargo ...,camex airlines,
Canada - Royal Canadian Air Force,https://linkedin.com/company/rcaf-arc,"Since its inception on 1 April 1924, the Royal Canadian Air Force (RCAF) has been a combat-tested force with decades of experience in the full spectrum of ...",canada - royal canadian air force,
Canadian North,https://linkedin.com/company/canadian-north,"Canadian North connects people and delivers essential goods throughout Northern communities in Canada – safely, reliably and always with ...",canadian north,
CanaryFly,https://linkedin.com/company/canaryfly,Canaryfly es la primera aerolínea Low Cost que vuela entre las Islas Canarias. En 2017 decidimos hacer las cosas de manera diferente y hemos conseguido en un ...,canaryfly,
CanWest Air,https://linkedin.com/company/can-west-corporate-air-charters-ltd.,"Can-West Corporate Air Charters offers charter service through our Edmonton, Slave Lake and Wabasca bases. From these locations we serve Western Canada.",canwest air,
Cape Air,https://linkedin.com/company/capeair,The nation's largest commuter airline connecting communities across the United States and Caribbean for over 30 years.,cape air,
Capital Air Ambulance,https://linkedin.com/company/capitalairambulance,"The UK's specialist air ambulance operator, providing rapid response UK, EU and global medical repatriations.",capital air ambulance,
Cardig Air,https://linkedin.com/company/pt-cardig-air,Website: www.cardig-air.com. External link for PT. Cardig Air. Industry: Airlines and Aviation. Company size: 51-200 employees. Type: Privately Held ...,cardig air,
CareFlight,https://linkedin.com/company/careflight,"CareFlight is an Australian aeromedical charity, established in 1986. CareFlight's mission is to save lives, speed recovery and serve the community.",careflight,
Cargo Air,https://linkedin.com/company/cargo-air-ltd,Cargo Air is cargo airline established in 1997 as operator of 6 aircraft AN-12 till 2007 and currently operating with B737-300/400 freighters.,cargo air,
Cargojet Airways,https://linkedin.com/company/cargojet-income-fund,Cargojet provides domestic and trans-border air cargo services in addition to aircraft handling and aircraft and airport equipment fueling services.,cargojet airways,
Cargolux,https://linkedin.com/company/cargolux-airlines,Cargolux is Europe's largest all cargo carrier and boasts a modern fleet of purpose-built 747-400 and 747-8 freighters. Cargolux was the launch customer for ...,cargolux,
Caribbean Airlines,https://linkedin.com/company/caribbean-airlines-ltd.,"Caribbean Airlines serves 16 markets in the Caribbean, South America and North America operating a core schedule of 530 weekly departures with a fleet of 21 ...",caribbean airlines,
Carpatair,https://linkedin.com/company/carpatair-sa,"Founded in 1999, Carpatair is one of the oldest airlines in Romania with headquarters in Timisoara and presently a charter and wet lease airline.",carpatair,
Carson Air,https://linkedin.com/company/carsonair,"We are the largest provider of Air Ambulance Services BC, with experience with Cargo and Flight Training.",carson air,
Caspian Airlines,https://linkedin.com/company/caspian-airlines,"an airline headquartered in Tehran, Iran. Established in 1993, it operates services between Tehran and other major cities in Iran and international flights.",caspian airlines,
Castle Aviation,https://linkedin.com/company/castleaviation,"The leader in passenger, cargo transportation and aircraft maintenance in Ohio. Located at the Akron-Canton Airport, our professional staff and aircraft will ...",castle aviation,
Cathay Pacific,https://linkedin.com/company/cathay-pacific,"Welcome to the official Cathay Pacific LinkedIn page. We have over 200 destinations in our global network, but want to do more than just move you from A to B.",cathay pacific,
Cavok Air,https://linkedin.com/company/cavok-air,The main activity directions of CAVOK AIR are: — Air cargo transportation — DG and special cargo transportation — Cargo charter operations with 24H flight watch ...,cavok air,
Cayman Airways,https://linkedin.com/company/cayman-airways,"Since 1968, Cayman Airways has been serving the Cayman Islands as the country's national airline, offering more flights to and from the Cayman Islands than any ...",cayman airways,
Cebu Pacific,https://linkedin.com/company/cebupacificair,"The Philippines' leading airline, Cebu Pacific (CEB) entered the aviation industry in March 1996 and pioneered the “low fare, great value” strategy in the ...",cebu pacific,
Ceiba Intercontinental,https://linkedin.com/company/oatc-omni-aviation-training-center,"For over 1️⃣0️⃣ years, White Airways operated a Boeing 777-2FB/LR on behalf of Ceiba Intercontinental. The 777LR variant holds the world record for the ...",ceiba intercontinental,
CemAir,https://linkedin.com/company/cemair,"CemAir is an aviation company based at OR Tambo International Airport, Jhb. The company owns and operates a fleet of Beechcraft 1900's and CRJ regional jets ...",cemair,
Central Airlines,https://linkedin.com/company/central-airlines,"Central Airline's technologically advanced fleet of 777Fand 737s offers flexible, creative, and award-winning solutions that meet your unique needs.",central airlines,
Central Mountain Air,https://linkedin.com/company/flycma,"Central Mountain Air | 7623 followers on LinkedIn. Cargo, Charter, and Scheduled airline proudly operating in Canada since 1987.",central mountain air,
Centreline,https://linkedin.com/company/centrelineav,"Centreline has a well-earned reputation as the “go to” choice for private jet management, private jet charter, aircraft maintenance, executive ground handling ...",centreline,
Chalair Aviation,https://linkedin.com/company/chalair-aviation,"Chalair Aviation is an airlines/aviation company based out of ROUTE DE CAEN, CARPIQUET, Lower Normandy, France. Website: http://www.chalair ...",chalair aviation,
Challenge Airlines BE,https://linkedin.com/company/ace-aviation-group,"Challenge Group is a unique, international air cargo conglomerate offering tailored and integrated end-to-end logistics solutions.",challenge airlines be,
companies_name,https://linkedin.com/company/compoundcontent,We help B2B companies generate demand with organic social. Join our waitlist. https://www.compoundcontentstudio.com/,companies_name,
Chartright Air,https://linkedin.com/company/chartright-air-group,"Chartright Air Group is a leading Canadian aviation services provider, offering a full range of solutions including private jet charter, JetClub memberships, ...",chartright air,
CHC Helicopter,https://linkedin.com/company/chc-helicopter,"CHC Helicopter provides unmatched helicopter services including transportation, Search and Rescue deployment, and MRO.",chc helicopter,
Chengdu Airlines,https://linkedin.com/company/chengdu-airlines-co-ltd-,"Chengdu Airlines Co., Ltd. · Truck Transportation · About us · Locations · Employees at Chengdu Airlines Co., Ltd. · Similar pages · Browse jobs · Sign in to ...",chengdu airlines,
China Airlines,https://linkedin.com/company/china-airlines,"China Airlines | LinkedIn'de 13.779 takipçi China Airlines from Taiwan since 1959 | Founded: December 16, 1959 Stock listed: February 26, 1993 Registered ...",china airlines,
China Cargo Airlines,https://linkedin.com/company/china-cargo-airlines-co-ltd,"China Cargo Airlines is a cargo airline with its head office at Hongqiao International Airport in Shanghai, People's Republic of China.",china cargo airlines,
China Eastern Airlines,https://linkedin.com/company/china-eastern-airlines-north-america,"As one of the three major air carriers in China, headquartered in Shanghai, China Eastern Airlines operates 111 domestic and overseas branches across the globe.",china eastern airlines,
China Express Airlines,https://linkedin.com/company/china-express-airlines,"China Express Airlines is an airline with its corporate headquarters on the grounds of Chongqing Jiangbei International Airport, Chongqing, People's Republic ...",china express airlines,
China Postal Airlines,https://linkedin.com/company/china-postal-airlines-co-ltd-,"China Postal Airlines Co.,Ltd. Linii aeriene și aviație. Beijing, Beijing 96 adepți. Urmăriți · Raportați această companie; Închideți meniul.",china postal airlines,
China Southern Airlines,https://linkedin.com/company/china-southern-airlines,"To mark the International Day of Cooperatives, China Southern Airlines and Vietnam Airlines will officially launch a joint venture cooperation!",china southern airlines,
China Southern Cargo,https://linkedin.com/company/china-southern-airlines/,"Recently, China Southern Airlines and Ethiopian Airlines signed a MOU to deepen cooperation across codeshare, connectivity, and cargo. This milestone marks ...",china southern cargo,
China United Airlines,https://linkedin.com/company/china-airlines,"Founded: December 16, 1959 Stock listed: February 26, 1993 Registered capital: NTD 54,209,846,500 160 destinations in 29 countries/districts, as of 30 JUN, ...",china united airlines,
Chrono Aviation,https://linkedin.com/company/chrono-aviation,Chrono Aviation is an aircraft charter and management company based in Quebec City. Our mission is to offer a service that has SAFETY as a priority.,chrono aviation,
Chrono Jet,https://linkedin.com/company/chrono-aviation,Chrono Aviation est une entreprise de nolisement et de gestion d'aéronefs basée à Québec. Notre mission est d'offrir un service qui a comme priorité la ...,chrono jet,
CITIC Offshore Helicopter,https://linkedin.com/company/citic-offshore-helicopter-co-ltd,"Citic Offshore Helicopter is a airlines/aviation company based out of SHENZHEN, GNG, China. Website: http://www.china-cohc.com.",citic offshore helicopter,
Citilink,https://linkedin.com/company/pt-citilink-indonesia,Citilink Indonesia has become the fastest growing airline in Indonesia since 2011 at the time when it took the first Airbus A320 aircraft and accelerated ...,citilink,
CityJet,https://linkedin.com/company/cityjet,CityJet operates a fleet of 21 88/90-seat CRJ900 aircraft and six 100-seat CRJ1000s. The majority of our aircraft operate under a wet lease contract for SAS ...,cityjet,
Civil Air Patrol,https://linkedin.com/company/civil-air-patrol,Про нас ; Вебсайт: https://www.gocivilairpatrol.com/. Зовнішнє посилання для Civil Air Patrol ; Галузь: Некомерційні організації ; Розмір компанії: Понад 10 001 ...,civil air patrol,
Clic,https://linkedin.com/company/clic-new-york,"Concept Store selling photography, fashion, lifestyle, and decor, Clic has locations in New York, California & St Barth.",clic,
CMA CGM Air Cargo,https://linkedin.com/company/cma-cgm,"CMA CGM AIR CARGO, the Group's air freight division, will operate a fleet of 6 cargo aircraft by 2025. CMA Media, France's 3rd largest private media group ...",cma cgm air cargo,
Coastal Aviation,https://linkedin.com/company/coastal-aviation-pty-ltd,"Located on the Sunshine Coast in Queensland, Australia, Coastal Aviation can provide diverse in-house solutions to suit your aviation requirements.",coastal aviation,
Colorful Guizhou Airlines,https://linkedin.com/company/transviet-cargo,... Colorful Guizhou Airlines (GY) over the past year. We sincerely thank GY for placing your trust in us as your partner in the Vietnamese market. This warm ...,colorful guizhou airlines,
Comlux,https://linkedin.com/company/comlux,"Comlux is one of the leaders in Business Aviation, Transaction and Completion services. For 20 years now, we have been Engineering luxury for VIP customers.",comlux,
CommuteAir,https://linkedin.com/company/commuteair,CommuteAir is a regional airline operating flights on behalf of United Airlines as a United Express partner. With a fleet of more than 55 Embraer ERJ145 ...,commuteair,
Compass Air Cargo,https://linkedin.com/company/compass-cargo-airlines,We are fast growing cargo airline operating with Boeing NG 737-800. Website: https://www.compasscargo.eu/.,compass air cargo,
Conair,https://linkedin.com/company/conair-corporation,"Conair is a leading international designer, manufacturer, and marketer of branded personal care and small kitchen appliances, cookware, hair brushes & ...",conair,
Conquest Air,https://linkedin.com/company/conquest-air-cargo,"We are an FAA Part 135 cargo airline based out of Miami Lakes, Florida. We own and operate three Convair 340s several times daily into Nassau, Bahamas and ...",conquest air,
Contour Aviation,https://linkedin.com/company/corporate-flight-management,We are more than a luxury charter company. We are multi-faceted aviation service experts that provide solutions for all your aviation needs.,contour aviation,
Conviasa,https://linkedin.com/company/conviasa/,"conviasa is a company based out of Venezuela. Website: http://conviasa.aero. External link for conviasa. Industry: Airlines and Aviation. Company size: 1,001- ...",conviasa,
Copa Airlines,https://linkedin.com/company/copa-airlines/,Copa Airlines is one of the leading airlines in Latin America and one of the most successful and profitable airlines in the world.,copa airlines,
Copenhagen Airtaxi,https://linkedin.com/company/copenhagen-airtaxi-a-s,"Time is money, everybody can agree to this. We fly you direct to your destination, often even closer than if you choose to fly by scheduled airlines.",copenhagen airtaxi,
Corendon Airlines,https://linkedin.com/company/corendonairlines,"Your Holiday Airline Corendon Airlines is an international airline company flying to 65 countries and 165 airports, transporting approximately 6 million ...",corendon airlines,
Corsair,https://linkedin.com/company/corsair,"Founded in 1994, CORSAIR (NASDAQ:CRSR) is a leading global developer and manufacturer of high-performance gaming and streaming gear.",corsair,
Costa Rica Green Airways,https://linkedin.com/company/cr-green-airways,"We are a costa rican owned family business, truly passionate for flying. Flying makes us happy and we want to share our happiness with our clients.",costa rica green airways,
Croatia Airlines,https://linkedin.com/company/croatia-airlines,"FULL COMPANY NAME: Croatia Airlines, the national air carrier, has been carrying passengers and cargo in domestic and international traffic for more than 30 ...",croatia airlines,
Cyprus Airways,https://linkedin.com/company/cyprusairways,"Cyprus Airways is based at Larnaca International Airport. The company's mission is to build a strong and reliable airline, offering safe and enjoyable flights ...",cyprus airways,
Czechia - Air Force,https://linkedin.com/company/tc-of-denmarkinczechia,"University of Defense, Brno and Polish Air Force University are set to host the 25th Air Defence Conference in Brno this April, focusing on Next-Generation ...",czechia - air force,
Daallo Airlines,https://linkedin.com/company/daallo-airlines,"DAALLO Airlines is a national carrier of Republic of Djibouti and operating scheduled passenger, cargo and charter flights to Africa, Middle East and Europe ...",daallo airlines,
Dalian Airlines,https://linkedin.com/company/china-southern-airlines,"On April 20th, China Southern Airlines partnered with the Dalian Cultural Tourism Bureau and Dayun Art Museum to launch ""Rhymes in the Sky""—a themed flight ...",dalian airlines,
Dan Air,https://linkedin.com/company/danair,"DAN AIR is a 100% Romanian airline, founded in 2017 by Captain Dan Iuhas, initially under the name Just Us Air. The company began by operating ACMI flights ...",dan air,
Dana Air,https://linkedin.com/company/danaair,"Dana Air is focused on bringing to Nigerians, an aviation service that combines the best elements of legacy carriers – world-class safety and quality on-board ...",dana air,
DAS Private Jets,https://linkedin.com/company/das-private-jets-gmbh,"DAS Private Jets GmbH ist ein Charter Operator mit einer Flotte moderner Business Jets, die in Mengen, Süddeutschland ihren Hauptstandort haben.",das private jets,
DAT,https://linkedin.com/company/dat-freight-and-analytics,"DAT Freight & Analytics operates DAT One, North America's largest truckload freight marketplace; DAT iQ, the industry's leading freight data analytics service.",dat,
Deer Jet,https://linkedin.com/company/deer-jet,"Since 1995, Deer Jet designs and provides the finest and most comprehensive services for business aviation worldwide.",deer jet,
Delta Air Lines,https://linkedin.com/company/delta-air-lines,"Delta Air Lines (NYSE: DAL) is the U.S. global airline leader in safety, innovation, reliability and customer experience. Powered by our employees around ...",delta air lines,
DHL Air,https://linkedin.com/company/dhl-air-uk,"DHL Air UK Ltd is the largest all-cargo air carrier in the UK, operating a fleet of B757, B767 and B777 aircraft supporting worldwide air-freight operations ...",dhl air,
Divi Divi Air,https://linkedin.com/company/divi-divi-air,"Divi Divi Air offers multiple flights from Curacao to Bonaire and Aruba and back. If traveling between the islands for business or pleasure, you are sure to ...",divi divi air,
