company_name,linkedin_url,description,company_name_norm,fleet_size
Estelar,https://linkedin.com/company/theestelar,"We are more than event planners, we are architects of eco-conscious experiences, turning dreams into reality with a reduced carbon footprint mindset.",estelar,
Estonia - Air Force,https://linkedin.com/company/eesti-kaitsevagi,"Welcome to the official LinkedIn page of the Estonian Defence Forces. https://www.mil.ee/en Locations Primary Juhkentali 58 Tallinn, Harju County 15007, EE",estonia - air force,
Eswatini Air,https://linkedin.com/company/royal-swazi-national-airways-corporation,"The national airline offers direct non-stop flights between KM III International Airport and Durban, Cape Town, Johannesburg and Harare.",eswatini air,
ETF Airways,https://linkedin.com/company/etfairways,"ETF Airways is a leading Croatian ACMI and charter airline, renowned for our reliability and dedication to delivering exceptional aviation services worldwide.",etf airways,
Ethiopian Airlines,https://linkedin.com/company/ethiopian-airlines,"Ethiopian Airlines Group (Ethiopian) is the fastest growing Airline Group in Africa. In its seventy plus years of operation, Ethiopian has become one of the ...",ethiopian airlines,
Etihad Airways,https://linkedin.com/company/etihadairways,"Marhaba! Welcome to Etihad Airways. We are proud to be the national airline of the UAE, flying to 100+ destinations via Abu Dhabi. At Etihad, we don't stop ...",etihad airways,
Euro Link,https://linkedin.com/company/eurolinkinc,"We've provided North America with high quality tapping, drilling, & ergonomics products since 2000 - now as IPT America.",euro link,
Euro-Asia Air,https://linkedin.com/company/euro-asia-air,"Euro-Asia Air is the largest helicopter airline in Kazakhstan. The use of helicopters and airplanes in the economy of Kazakhstan (large territory, difficult ...",euro-asia air,
EuroAtlantic Airways,https://linkedin.com/company/euroatlantic-airways/,"EAA is a Portuguese International Airline, operating in the most diverse routes in North Atlantic with an air transport license and FAOC to operate into North ...",euroatlantic airways,
Euroavia Airlines,https://linkedin.com/company/euroavia,"We are EUROAVIA, the European Association of Aerospace Students, and we represent the interests of over 3000 students from 42 universities in 18 countries.",euroavia airlines,
Eurocopter Deutschland,https://linkedin.com/company/airbus-helicopters,"Info. Airbus Helicopters, vormals Eurocopter, ist eine Division der Airbus Group, die zu den weltweit führenden Konzernen der Luft- und Raumfahrt sowie der ...",eurocopter deutschland,
European Air Charter,https://linkedin.com/company/bulgarian-air-charter,"Bulgarian Air Charter Jsc. is a charter airline based in Sofia, Bulgaria. Bulgarian Air Charter has offices in Sofia, Berlin, Varna, Burgas and Rome.",european air charter,
European Aircraft Private Club,https://linkedin.com/company/european-aircraft-private-club-scrl,"European Aircraft Private Club is a cooperative company, which offers its members a high standard fleet of mono turbine aircrafts. Our team of professionals can ...",european aircraft private club,
European Cargo,https://linkedin.com/company/european-cargo,"European Cargo has helped to establish Bournemouth International Airport as a reliable, cost-effective, and strategic air freight hub, 90 minutes from London.",european cargo,
European Flight Academy,https://linkedin.com/company/european-flight-training,"European Flight Training | 89 followers on LinkedIn. With almost 10000 hours total flight time, 25 years as a Professional Pilot and worldwide airline ...",european flight academy,
European Flight Service,https://linkedin.com/company/efs-european-flight-service-ab,"The largest Part 135 charter company in Sweden, operating Gulfstream GV, Bombardier Challenger 350 and various Cessna models.",european flight service,
European Flyers,https://linkedin.com/company/european-flight-training,"With almost 10,000 hours total flight time, 25 years as a Professional Pilot and worldwide airline flying experience including Transatlantic and ...",european flyers,
Eurowings,https://linkedin.com/company/eurowings-aviation-gmbh,Quality flights at reasonable prices. To over 130 destinations in Europe and worldwide. This is what the Eurowings brand stands for.,eurowings,
EVA Air,https://linkedin.com/company/eva-airways,"Building on quality service and safety for over 25 years, EVA is now rated as a 5-Star Airline by international quality ratings organization SKYTRAX.",eva air,
Everett Aviation,https://linkedin.com/company/everett-aviation,Everett Aviation started business operating a single AS350 in Kenya in 1996. In less than 20 years it has become established as the largest helicopter service ...,everett aviation,
Everts Air Alaska,https://linkedin.com/company/everts-air-cargo,"Everts Air Alaska is a Part 135 airline based in Fairbanks, providing cargo and passenger service to interior Alaska.",everts air alaska,
EWA Air,https://linkedin.com/company/ewa-air,"EWA AIR is an airlines/aviation company based out of, Marcel Henri Airport, Mayotte, France. Site web: https://ewa-air.",ewa air,
ExcelAire,https://linkedin.com/company/excelaire-services-llc,"ExcelAire, one of the nation's leading private jet charter firms, specializes in worldwide jet charters, aircraft management, maintenance and sales.",excelaire,
Excellent Air,https://linkedin.com/company/excellentair,"Being part of the Air Allgäu Group, Excellent Air was established in 2014 to cater to the demanding charter markets. As a growing business, the group offers ...",excellent air,
Exclusive Aviation,https://linkedin.com/company/exclusive-aviation,"Exclusive Aviation is a premier private aviation operator based in The Bahamas, renowned for delivering bespoke aviation services that adhere to the highest ...",exclusive aviation,
Execuflight,https://linkedin.com/company/executive-airlink-inc,Sitio web: http://executiveairlink.com. Enlace externo para EXECUTIVE AIRLINK INC ; Sector: Aeronáutica y aviación ; Tamaño de la empresa: De 11 a 50 empleados.,execuflight,
ExecuJet Middle East,https://linkedin.com/company/execujet-aviation-group/,"At ExecuJet Middle East, your comfort is cared for at every step of the journey. Discover our crew suite at Al Maktoum, designed with your wellbeing in mind.",execujet middle east,
Executive Airlink,https://linkedin.com/company/executive-airlink-inc,"Executive Airlink offers a top-class jet service throughout the USA, with bases in Palm Beach and Boca Raton. Its expanding fleet of modern and comfortable ...",executive airlink,
companies_name,https://linkedin.com/company/alacrity-e-commerce-solutions-private-limited,"Alacrity E-Commerce Solutions has since its inception been providing professional, affordable & exclusive e-commerce solutions & services.",companies_name,
Executive Aviation Services,https://linkedin.com/company/eas-executive-aviation-services,Executive Aviation Services GmbH has been founded in 2015 and has become one of the leading providers of aviation consulting services.,executive aviation services,
Executive Fliteways,https://linkedin.com/company/fly-executive-fliteways,Executive Fliteways is a private charter and aircraft management company with over 40+ years in the business. Under new and exciting management with an ...,executive fliteways,
Executive Jet Management,https://linkedin.com/company/executive-jet-management,"Drawing on over 45 years of aviation expertise, Executive Jet Management (EJM) leads the industry in aircraft management and private jet charter.",executive jet management,
Express Air Cargo,https://linkedin.com/company/express-air-cargo,Express Air Cargo is an all-cargo airline that offers a fast and efficient service thanks to its fleet of Boeing 737-300 and 800 freighters.,express air cargo,
Exxaero,https://linkedin.com/company/exxaero,"As a private jet company, we believe that travel should not just be a necessity but an experience that is enjoyable, safe, and relaxing.",exxaero,
Eznis Airways,https://linkedin.com/company/eznis-airways,Welcome aboard of Eznis Airways. Our vision is to make Mongolia more accessible to the world. Travel gives priceless memories and experiences.,eznis airways,
Ezy Airlines,https://linkedin.com/company/ezy,"With its background in the travel trade and focus on customers within the travel industry, ezy has acquired an extensive experience and knowledge about the ...",ezy airlines,
FAI rent-a-jet,https://linkedin.com/company/fai-rent-a-jet-gmbh/,Imprint FAI rent-a-jet GmbH Flughafenstrasse 124 D-90411 Nuremberg Phone: +49-911-36009-0 Telefax: +49-911-36009-59 E-Mail: info@fai.ag Represented by the ...,fai rent-a-jet,
Fairoaks Flight Centre,https://linkedin.com/company/air-partner,"We operate a full in-house 24/7 global flight operations centre, providing clients with instant access to our services all year round. Our ...",fairoaks flight centre,
Falcon Aviation Services,https://linkedin.com/company/falcon-aviation-services,"Falcon Aviation Services stands at the forefront of aviation excellence in the UAE and across the wider MENA region. Since 2006, we have played ...",falcon aviation services,
Falcon Luxe,https://linkedin.com/company/falconav,"We deliver the most safe, comfortable, and reliable private flying experience, tailored to you. Falcon Elite Exceptional private jet terminals (FBOs). Falcon ...",falcon luxe,
Fanjet Express,https://linkedin.com/company/abtech-precision-ireland-ltd,"Abtech Precision is an engineering company based in Collooney, Co. Sligo, providing a wide range of top quality precision engineering services and components ...",fanjet express,
Farmingdale State University Aviation,https://linkedin.com/company/icarus-flying-academy,Icarus Flying Academy is a New York based flight school serving the tri-state area. Founded by two highly motivated and aviation struck enthusiasts.,farmingdale state university aviation,
Fast Air,https://linkedin.com/company/fast-air-ltd,"Fast Air is one of Canada's fastest-growing business aviation companies, proudly family-owned and operated. For 30 years we've been trusted by professionals ...",fast air,
Fastjet,https://linkedin.com/company/fastjet,"Fastjet | Zimbabwe, South Africa http://www.fastjet.com Locations Primary 43 Van Buuren Rd Bedfordview, Gauteng 2007, ZA Get directions",fastjet,
Federal Airlines,https://linkedin.com/company/federal-airlines,"Federal Airlines promotes diversity and is an equal opportunity employer. We appreciate all applicants' interest, but only selected candidates will be contacted ...",federal airlines,
FedEx,https://linkedin.com/company/fedex,"FedEx connects people and possibilities through our worldwide portfolio of shipping, transportation, e-commerce and digital supply chain services.",fedex,
Fenix Air Charter,https://linkedin.com/company/fenix-air-charter,"We offer charter flights for passenger and cargo, 24/7. When time is of the essence, we are your #1 call! Our crews consist of the utmost professional pilots.",fenix air charter,
Feuerwehr-Flugdienst Niedersachsen,https://linkedin.com/company/johanniter-luftrettung,Aus Liebe zum Leben: Notfallärztin bei der Johanniter Luftrettung Anja Henke gehört seit 2021 zum Team der Johanniter Luftrettung in Rostock.,feuerwehr-flugdienst niedersachsen,
FFL Flugschule,https://linkedin.com/company/ffl-fachschule-f%C3%BCr-luftfahrzeugf%C3%BChrer-gmbh,http://www.flugschule-ffl.de. Externer Link zu FFL Fachschule für Luftfahrzeugführer GmbH. Branche: Fluggesellschaften und Luftfahrt. Größe: 2–10 Beschäftigte.,ffl flugschule,
Fiji Airways,https://linkedin.com/company/fiji-airways,"For more than seven decades, Fiji Airways has been Fiji's bridge to the world. We're currently flying in more than 90% of all visitor arrivals to the country.",fiji airways,
Finistair,https://linkedin.com/company/finist'air,Finistair | 1 446 abonnés sur LinkedIn. Finistair est une compagnie aérienne créée en 1981 pour assurer des dessertes régionales en avion en Bretagne ...,finistair,
Finland - Air Force,https://linkedin.com/company/defencecommandfinland,Website: http://www.sam-int.fi. External link for Finnish Air Force ; Industry: Staffing and Recruiting ; Company size: 11-50 employees ; Type: Partnership.,finland - air force,
Finnair,https://linkedin.com/company/finnair,"Founded in 1923, Finnair is one of the world's oldest operating airlines. We are a network airline specialised in connecting Europe, North America and Asia via ...",finnair,
FinnHEMS,https://linkedin.com/company/finnhems-oy,FinnHEMS Oy · IT Services and IT Consulting · About us · Locations · Employees at FinnHEMS Oy · Similar pages · Sign in to see who you already know at FinnHEMS ...,finnhems,
Fireblade Aviation,https://linkedin.com/company/fireblade-aviation,"A world-class private aviation business since 2014. Located near OR Tambo International Airport, we position ourselves as the gateway to Africa.",fireblade aviation,
Firefly,https://linkedin.com/company/fireflyai/,"Firefly is a cloud infrastructure automation platform that empowers Platform and DevOps teams to simplify, secure, and scale their cloud operations.",firefly,
FitsAir,https://linkedin.com/company/fitsair,"FitsAir is Sri Lanka's pioneering low-cost carrier and the country's first privately-owned international airline, proudly serving the aviation industry since ...",fitsair,
Flair Airlines,https://linkedin.com/company/flair-airlines,"Flair is Canada's most reliable and affordable airline, and we're on a mission to make air travel easier for all. That means transparent and ...",flair airlines,
Fleet Air International,https://linkedin.com/company/fleet-air-international-kft,To perfect and market their vast expertise in the field of Air Transportation several important players incorporated FleetAir in Hungary as their high-end ...,fleet air international,
Flexflight,https://linkedin.com/company/flexflight,"FLEXFLIGHT® operates Business Jets ranging from PC-12 to Global6000 on our danish AOC, specializing in tailor-made Management Models to meet our clients needs ...",flexflight,
Flexjet,https://linkedin.com/company/flexjet,Flexjet first entered the fractional jet ownership market in 1995. Flexjet offers fractional jet ownership and leasing.,flexjet,
Flight Calibration Services,https://linkedin.com/company/flight-calibration-services-limited,FCSL provides cost effective flight calibration / inspection / validation / checking for the full range of aircraft radio navigation aids.,flight calibration services,
Flight Fast Track,https://linkedin.com/company/fast-track-flight,"We specialize in exportation and ferry flying of numerous types of aircraft and helicopters. Our proven record of safety, efficiency, and abundance of flying ...",flight fast track,
Flight Options,https://linkedin.com/company/flight-options,"Flight Options, LLC is the second-largest private aviation company in the United States, providing more than 1,300 Owners and clients with a full suite of ...",flight options,
Flight Training Europe,https://linkedin.com/company/atlantic-flight-training-academy,Atlantic Flight Training Academy is one of Europe's leading independent Flight Training Organisation for Aviation Personnel. Founded in 1995 by Head of ...,flight training europe,
Flightline,https://linkedin.com/company/flightline-sl,"Flightline is a leading organization in the aviation industry, committed to delivering high-quality aircraft maintenance and management services.",flightline,
Flightlink,https://linkedin.com/company/flightlinktz,"Flightlink is a scheduled and Corporate Airline based in Dar Es Salaam. Daily flights to Arusha, Zanzibar & Serengeti.",flightlink,
Flightpath Charter Airways,https://linkedin.com/company/flightpath-charter-airways,Flightpath offers private jet services in both the US & Canada. The average managed aircraft generates over $1M in charter revenue per year for its owner.,flightpath charter airways,
Flightstar,https://linkedin.com/company/flightstar,Flightstar has been in business as the Fixed Base Operator at Champaign-Urbana's Willard Airport (KCMI) since December of 1978.,flightstar,
Flightworks,https://linkedin.com/company/flightworks,"FlightWorks is a trusted leader in world-class Private Air Charter, Asset Management, Government Services, and Aviation Consulting Services.",flightworks,
Florida Air Cargo,https://linkedin.com/company/florida-air-cargo,"Florida Air Cargo provides cost-effective same day or next day air cargo services throughout the Bahamas, Caribbean Central and South America.",florida air cargo,
Florida Flyers Flight Academy,https://linkedin.com/company/floridaflyers,"Top rated fixed-price flight school and aviation flight training school in Florida, USA. DGCA, EASA ATO and FAA courses.",florida flyers flight academy,
Florida Tech College of Aeronautics,https://linkedin.com/company/fit-aviation-llc,"Degrees in aviation are also offered through Florida Tech's College of Aeronautics at the bachelor's, master's, and doctoral levels. Since our beginning in 1968 ...",florida tech college of aeronautics,
Fltplan,https://linkedin.com/company/fltplan-com,"Locations · Primary. 600 Independence Ave Sw. Washington, DC 20024, US. Get directions · 80 Union Church Rd. Trenton, Tennessee 38382-9439, US. Get directions ...",fltplan,
Fly 7,https://linkedin.com/company/fly-7-executive-aviation-sa/,"We are the largest commercial Pilatus PC-12 operator, the fastest growing jet broker team and the biggest Pilatus training Centre in Europe.",fly 7,
Fly Across,https://linkedin.com/company/fly-across-el-cielo-sin-limites/,"Somos una empresa de aviación privada y servicios de Hangar y FBO. Desde 2009 revolucionamos la aviación ejecutiva en México, ofreciendo a nuestros clientes los ...",fly across,
Fly Alliance,https://linkedin.com/company/flyalliance,"We specialize in private jet charters, personalized service, and unmatched client care. No AI. Real prices. Real People. Call us for a quote today - (407) 747- ...",fly alliance,
Fly AllWays,https://linkedin.com/company/flyallways,FlyAllways is dedicated to bringing true Suriname – Caribbean hospitality to air travel. Our aim is to make your journey a pleasant one.,fly allways,
Fly ALS,https://linkedin.com/company/als-limitedkenya,"Website: http://www.flyals.com. External link for ALS Limited ; Industry: Airlines and Aviation ; Company size: 201-500 employees ; Headquarters: Nairobi , Kenya.",fly als,
Fly Angola,https://linkedin.com/company/fly-angola,FLY Angola (EQ) is a private airline that serves a network of destinations in Angola. It was established in August 2018 by a group of Angolan businessmen.,fly angola,
Fly Away,https://linkedin.com/company/fly-away,Fly Away Fly Away is the first primary provider of support services to general aviation operators in Lublin Airport. As FBO (Fixed Base Operators) supports ...,fly away,
Fly Baghdad,https://linkedin.com/company/flybaghdad,"Fly Baghdad is the first low-cost carrier in Iraq, it provides you with the comfort, punctuality, and reliability for the best prices.",fly baghdad,
Fly Cham,https://linkedin.com/company/fly-cham,"Job Opportunity – Cargo Manager (CH-VA-25-114) Location Damascus, Syria - Fly Cham Head Office Employment Type Full-time Application Deadline 31, ...",fly cham,
Fly Jet.kz,https://linkedin.com/company/flyjets,"Global aviation marketplace and home of The FLY Report. FLYJETS, which operates as FLY I Corporation, is a New York State Benefit Corporation.",fly jet.kz,
Fly Jinnah,https://linkedin.com/company/flyjinnah,"Welcome to Fly Jinnah, Pakistan's leading low-cost airline. Operating out of our base in Karachi, we proudly connect five cities across Pakistan.",fly jinnah,
Fly Khiva,https://linkedin.com/company/fly-khiva,"Fly Khiva Group was founded in 2021 in the city of Khiva, Uzbekistan with the aim of developing passenger, cargo, and business aviation.",fly khiva,
Fly OYA,https://linkedin.com/company/flyoya,Fly Oya International is a Libyan limited company that was established in 2018 to provide high-quality air transport services to and from Libya. It conducts its ...,fly oya,
Fly Pro,https://linkedin.com/company/flypro-com,"FLYPRO.com is a factory-based direct sales store focusing on optical modules and fiber optic cables. There is no agent, we help you save your budget.",fly pro,
Fly Sky Airlines,https://linkedin.com/company/flysky-aviation-pvt-ltd,We specialize in covering all the customer needs in Airport Ground Operations or Over Flight and Landing permissions via most difficult regions.,fly sky airlines,
Fly Tyrol,https://linkedin.com/company/flytyrol/,Fly Tyrol is based in Innsbruck - the heart of the Alps - and serves as your premier partner for aircraft management and charter flights in western Austria.,fly tyrol,
Fly Us,https://linkedin.com/company/flyus,"FlyUs Aviation Group is an independent, privately-owned GSSA. Our focus is our customers, staff, airlines and partners, for whom we constantly strive for ...",fly us,
Fly Vaayu,https://linkedin.com/company/vaayu-group,The Vaayu Group aims to rethink solutions for challenges within the aviation industry with a keen eye on the future. Grown both organically and ...,fly vaayu,
Fly-Coop Air Service,https://linkedin.com/company/fly-coop,"L'azienda Fly Coop nasce nel 2008 e, da subito, diventa punto di riferimento per importanti aziende del Centro-Sud Italia per alcuni dei suoi servizi ...",fly-coop air service,
Fly2Sky,https://linkedin.com/company/fly2sky,Fly2Sky is an EASA and IOSA certified charter and ACMI operator as well as an expert aircraft management services provider.,fly2sky,
Fly4 Airlines,https://linkedin.com/company/fly4-airlines,"FLY4 Airlines, Ireland's newest airline, provides reliable & quality complementary capacity solutions to its shareholders, Enter Air and TUI, as well as 3rd ...",fly4 airlines,
Fly540,https://linkedin.com/company/fly540-aviation-ltd,"Five Forty Aviation Limited, commonly known as 540 is a Kenyan company which was established in 2005 and commenced operations in November 2006. Fly540 ...",fly540,
Fly91,https://linkedin.com/company/fly91-in,FLY91 is a regional carrier that strives to enhance air connectivity from tier 2 and tier 3 towns across India. Founded by industry veterans and ...,fly91,
flyadeal,https://linkedin.com/company/flyadeal,"Welcome to flyadeal, a new single-class low fares carrier in Saudi Arabia. An airline born from a different perspective. We are passionate about innovation ...",flyadeal,
FlyArystan,https://linkedin.com/company/flyarystan,About us. Kazakhstan's first low-cost air carrier. Website: https://flyarystan.com/. External link for FlyArystan. Industry: Airlines and Aviation. Company size ...,flyarystan,
FlyBig,https://linkedin.com/company/flybig-airlines,"At flybig, we prioritize safety, reliability, and exceptional customer service. Our dedicated team ensures a seamless travel experience for our valued ...",flybig,
Flybondi,https://linkedin.com/company/flybondi,"Flybondi es la primera aerolínea low cost de la Argentina, basada en una alta eficiencia que nos permite tener los precios más bajos del mercado, ...",flybondi,
FlyBy,https://linkedin.com/company/flybyschool,FlyBy is a dedicated airline pilot training academy with a long history of successfully training ab initio pilots to be the present and future captains.,flyby,
Flycom Aviation,https://linkedin.com/company/flycomaviation,"Flycom Aviation. Airlines and Aviation. Begunjska cesta 10a, Lesce 570 followers. We are specialized in demanding helicopter operations such as aerial work ...",flycom aviation,
flydubai,https://linkedin.com/company/flydubai,"From its home in Dubai, flydubai has created a network of more than 136 destinations served by a fleet of 85 aircraft.",flydubai,
FlyErbil Airline,https://linkedin.com/company/flyerbil,Website: http://www.flyebl.com. External link for Fly Erbil. Industry: Airlines and Aviation. Company size: 201-500 employees. Type: Partnership ...,flyerbil airline,
flyExclusive,https://linkedin.com/company/flyexclusive,"flyExclusive is a leading Part 135 owner and operator of private jet experiences delivering the ultimate private jet experience to Owners, ...",flyexclusive,
FLYGTA Airlines,https://linkedin.com/company/flygta,"FLYGTA Airlines | 1329 followers on LinkedIn. Executive Jet Charters, City Airplane Tours, Scheduled Flights | Reinventing aviation for a new generation ...",flygta airlines,
Flylili,https://linkedin.com/company/flylili,"Established in Q4 2020, we are proud to be a fully Romanian airline, dedicated to providing exceptional service and connectivity to passengers.",flylili,
FlyMe,https://linkedin.com/company/flymeavia,"Welcome to Flyme Aviation, a leading provider of aircraft chartering and leasing solutions. With a passion for aviation and a commitment to exceptional service, ...",flyme,
FlyMontserrat,,,flymontserrat,
FlyNamibia,https://linkedin.com/company/flywestair,"Where rivers change names and herds cross countries. Follow the Kwando as it becomes the Linyanti, and the Chobe as it joins the Zambezi.",flynamibia,
flynas,https://linkedin.com/company/flynas,We're proud to celebrate the success of over 30 students who have completed a comprehensive three-month training journey with flynas .,flynas,
FlyOne,https://linkedin.com/company/flyone,"FLYONE - Republic of Moldova's Airline that offers you a Safe, Comfortable and Affordable flight alternative to the most important destinations in Europe and ...",flyone,
FlySafair,https://linkedin.com/company/flysafair,"FlySafair is South Africa's true low cost airline. We took to the skies in October 2014 and have expanded fast, linking several key destinations in South ...",flysafair,
