company_name,linkedin_url,description,company_name_norm,fleet_size
font-qanelas,inline-flex href,font-qanelas 4,font-qanelas,
21 Air,https://linkedin.com/company/21air,"21 AIR is a certificated United States PART 121 All Cargo Carrier, with full SMS implementation compliance, under newly established commercial aviation ...",21 air,
247 Aviation,https://linkedin.com/company/247-aviation,"247 Aviation responds to medical emergencies throughout the world, 24 hours a day, 365 days a year ensuring we are here for you at a time when you need it most.",247 aviation,4.0
2Excel Aviation,https://linkedin.com/company/2excel-group,"Founded in 2005 by two former Royal Air Force pilots, 2Excel has grown from five people and four aerobatic aircraft to a fleet of 30+, with more than 300 people ...",2excel aviation,24.0
30 West Jets,https://linkedin.com/company/slate-aviation,"Tri State Charter, marketed as Slate Aviation, is one of the nation's largest operators of Challenger 850 and VIP Bombardier Regional Jet aircraft.",30 west jets,
4Airways,https://linkedin.com/company/4-airways,"4Airways is a startup airline focused on Wet Leasing and ACMI services, designed to cater to a wide range of aviation requirements.",4airways,
748 Air Services,https://linkedin.com/company/748-air-services-k-ltd,"748 Air Services is an air operating company and holds an Air Operating Certificate, Air Service Licence and an imbedded Aircraft Maintenance Organization ...",748 air services,6.0
7Air Cargo,https://linkedin.com/company/7air-cargo,"At 7Air, our unwavering dedication to providing dependable cargo services extends beyond mere promises; it's a mission deeply ingrained in our ethos.",7air cargo,
9 Air,https://linkedin.com/company/%E4%B9%9D%E5%85%83%E8%88%AA%E7%A9%BA%E6%9C%89%E9%99%90%E5%85%AC%E5%8F%B8,"9 Air is an airline in China, headquartered in Guangzhou. Website: http://www.9air.com. External link for 9 Air Co., ...",9 air,27.0
Abakan Air,https://linkedin.com/company/blacklist-aero,"number RA-76370 of ABAKAN AIR (PUMV FZE) arrived from Uganda to OMDW ... IMPORTANT NOTE: Abakan Air was designated by the U.S. OFAC on June 12, 2024 ...",abakan air,5.0
Abu Dhabi Aviation,https://linkedin.com/company/abu-dhabi-aviation/,"Abu Dhabi Aviation (ADA) stands out as a global leader in aviation, truly a UAE Champion on a World stage. ADA offers a comprehensive range of services for ...",abu dhabi aviation,14.0
ABX Air,https://linkedin.com/company/abx-air-inc.,"ABX Air is an FAR Part 121 cargo airline flying express cargo routes for customers in the US and around the world, offering customized charter services.",abx air,11.0
ACASS Ireland,https://linkedin.com/company/acass,"ACASS is a leading worldwide provider of best-in-class business aviation support services, including aircraft sales, aircraft management, flight crew staffing ...",acass ireland,2.0
Advanced Air,https://linkedin.com/company/advancedairlines,"Advanced Air, LLC is an innovative, service-oriented aviation company headquartered in Hawthorne, California, approximately three miles from LAX.",advanced air,23.0
Advanced Flight Training,https://linkedin.com/company/advanced-flight-training-leasing,"Advanced Flight Training and Leasing offers seaplane training at your location, in your aircraft. We are part of Wipaire, the world's leading manufacturer of ...",advanced flight training,5.0
Aegean Airlines,https://linkedin.com/company/aegean-airlines,"AEGEAN connects every corner of Greece with 180 destinations, in 49 countries with 307 routes and a total fleet of 76 aircraft, including the brand-new Airbus ...",aegean airlines,68.0
Aegean Executive,https://linkedin.com/company/e-mba-programme---university-of-the-aegean,"Το Πρόγραμμα εστιάζει στους τομείς της Ελεγκτικής – Εταιρικής Διακυβέρνησης, της Διοικητικής Επιστήμης, της Διοίκησης και Οργάνωσης Επιχειρήσεων και της ...",aegean executive,2.0
Aer Lingus,https://linkedin.com/company/aer-lingus,"Aer Lingus is the national airline of Ireland, founded in 1936. It operates a modern aircraft fleet to destinations in the UK, Europe and North America.",aer lingus,80.0
AerCaribe Cargo,https://linkedin.com/company/aercaribe/,"La Empresa se enfoca en la prestación de servicios de transporte aéreo de vuelos cargo y charter en Latinoamérica y el Caribe, también prestamos servicio de ...",aercaribe cargo,
Aero,https://linkedin.com/company/aero-fabrications-limited,Aero Fabrications Limited is a privately owned business located in the heart of the United Kingdom. We specialise in the manufacture of precision fabricated ...,aero,7.0
Aero,https://linkedin.com/company/goaero,"Aero, a next generation air travel company, is building a seamless way to travel to the best leisure destinations in the world.",aero,7.0
Aero Asahi,https://linkedin.com/company/aero-asahi-corporation,"AERO ASAHI CORPORATION which is holding by TOYOTA Motor Co.rporation. The following division are consisted, Aviation Business and Special Information ...",aero asahi,39.0
Aero Charter,https://linkedin.com/company/aero-charter,"With over 40 years experience, Aero Charter provides remarkable customer care in Aircraft Charter, Aircraft Sales and Management, FBO Service, Avionics, and ...",aero charter,13.0
Aero Charter and Transport,https://linkedin.com/company/aero-charter,"Aero Charter is your total aviation solution. With over 40 years experience, Aero Charter provides remarkable customer care in Aircraft Charter, ...",aero charter and transport,
Aero Clube de Coimbra,https://linkedin.com/company/anac---autoridade-nacional-da-avia%C3%A7%C3%A3o-civil,"A Autoridade Nacional da Aviação Civil (ANAC) é a autoridade nacional em matéria de aviação civil, pessoa coletiva de direito público, com a natureza de ...",aero clube de coimbra,
Aero Coatl Mexicano,,,aero coatl mexicano,
Aero Dili,https://linkedin.com/company/aero-dili,"Aero Dili or Aero Dili Service Transport, SA was established in 2017 and received an Air Operator Certificate in 2018 and operates and serves domestic flights ...",aero dili,2.0
Aero K,https://linkedin.com/company/aero-k-airlines,"에어로케이 다움 우리는 긍정의 에너지와 즐거움을 나누기 위해 보살핌과 신뢰, 그리고 기술에 기반한 서비스로 사람, 장소(커뮤니티), 파트너들을 연결합니다.",aero k,
Aero Mongolia,https://linkedin.com/company/aero-mongolia,"Established in 2001 as Mongolia's first privately owned airline, we take great pride in providing our valued customers with exceptional air travel experiences.",aero mongolia,5.0
Aero Nomad,https://linkedin.com/company/aero-nomad-airlines,Aero Nomad Airlines is a Kyrgyz airline established in 2021. One of the priorities of «Aero Nomad Airlines» is the operation of comfortable Western-made Airbus ...,aero nomad,
Aero Sotravia,https://linkedin.com/company/air-marine,"AERO SOTRAVIA. Movies, Videos, and Sound. Alexandria, cestovní kancelář. Leisure, Travel & Tourism. Rectimo Aviation SAS. Aviation and Aerospace Component ...",aero sotravia,5.0
Aero Tak,https://linkedin.com/company/aero-tak-limited,"AERO TAK LIMITED. Airlines and Aviation. Abuja, Abuja 486 followers. We bring good things to life. Follow · Report this company; Close menu.",aero tak,
Aero Ways,https://linkedin.com/company/aerowise,What We Do: ✔️Tailored international trip support services ✔️Aviation procurement ✔️Aircraft Charter Broker ✔️Ground handling services ✔️Overflight and landing ...,aero ways,6.0
Aero-Beta Flight Training,https://linkedin.com/company/flugbetrieb-aero-beta,Insgesamt besteht unser Team aus mehr als 100 Fluglehrern an allen vier Standorten. Diese begleiten und unterstützen Sie bei Ihrer Ausbildung und geben ihre ...,aero-beta flight training,12.0
Aero-Dienst,https://linkedin.com/company/aero-dienst/,"With a 65-year track record in maintaining, operating, selling and managing a wide range of business and ambulance aircraft, Aero-Dienst is considered one of ...",aero-dienst,5.0
Aero-Tech Services,https://linkedin.com/company/aero-tech-services-inc-,"Aero-Tech Services, Inc. is a “Learn-to-Fly” Part 141 flight school, air charter, and airplane maintenance center located at the Lancaster, Pennsylvania (KLNS) ...",aero-tech services,4.0
Aeroclub Barcelona-Sabadell,https://linkedin.com/company/aeroclub-barcelona-sabadell,"With more than 1000 members, and founded in 1953, the Aeroclub Barcelona-Sabadell is the largest flying club in Spain and the second in Europe.",aeroclub barcelona-sabadell,14.0
Aerodynamics Academy,https://linkedin.com/company/aerodynamicsacademy,"Aerodynamics Academy es, desde su creación en 1998, una de las principales Escuelas de Formación Aeronáutica Oficial del sur de España.",aerodynamics academy,17.0
Aeroflot,https://linkedin.com/company/aeroflot---russian-airlines/,"Aeroflot is Russia's de facto National carrier and largest Airline. Founded on March 17, 1923, Aeroflot is among the world's oldest airlines and one of Russia's ...",aeroflot,169.0
AeroGuard Flight Training Center,https://linkedin.com/company/aeroguard-flight-training-center,"AeroGuard Flight Training Center is THE Commercial Pilot School, training and preparing future commercial airline pilots for careers at the world's leading ...",aeroguard flight training center,113.0
Aeroitalia,https://linkedin.com/company/aeroitalia/,"Locations · Primary. Viale Cesare Pavese, 8. Rome, 00144, IT. Get directions · Aeroporto Roma Fiumicino ""Leonardo Da Vinci"". Fiumicino , Italia 00054, IT. Get ...",aeroitalia,13.0
Aerolineas Argentinas,https://linkedin.com/company/aerolineas-argentinas,Aerolíneas Argentinas es la compañía líder en el mercado aerocomercial argentino y referente en la región desde 1950. Su flota de 84 aviones alcanza 38 destinos ...,aerolineas argentinas,84.0
Aerolineas Ejecutivas,https://linkedin.com/company/aerolineas-ejecutivas,"Con una distinguida trayectoria de 55 años, Aerolíneas Ejecutivas ha alcanzado reconocimiento internacional al fungir como representante exclusivo en México de ...",aerolineas ejecutivas,26.0
Aerolineas Sosa,https://linkedin.com/company/aerol%C3%ADneas-sosa,Website: http://www.aerolineasosahn.com/. External link for Aerolíneas Sosa. Locations. Get directions. Employees at Aerolíneas Sosa.,aerolineas sosa,4.0
AeroLogic,https://linkedin.com/company/aerologic,"Established in September 2007, AeroLogic's first plane took off in the summer of 2009 with the fleet eventually comprising 8 brand-new Boeing 777F's. The ...",aerologic,
Aeromas,https://linkedin.com/company/aeromas-sas,"Somos una empresa colombiana especializada exclusivamente en el transporte aéreo medicalizado para pacientes adultos, obstétricas, pediátricos y neonatales ...",aeromas,2.0
Aeromexico,https://linkedin.com/company/aeromexico,"As a founding member of the SkyTeam airline alliance, Aeromexico offers customers more than 1,000 destinations in 177 countries served by the 20 ...",aeromexico,125.0
Aeromexico Connect,https://linkedin.com/company/aeromexico,"Aeromexico, Mexico's global airline, operates more than 600 daily flights and has its main hub in Terminal 2 of the Mexico City International ...",aeromexico connect,
Aeronaves TSM,https://linkedin.com/company/tsm-connect-sa-de-cv,"TSM Connect. Transportation, Logistics, Supply Chain and Storage. Zona Centro, Coahuila 259 followers. Follow · Report this company; Close menu.",aeronaves tsm,97.0
Aeropapa,,,aeropapa,
Aeropartner,https://linkedin.com/company/aeropartner,Aeropartner a.s. | 721 followers on LinkedIn. We are well-established air charter company founded in 2001. We dispose of a fleet of fast and cosy bizjet ...,aeropartner,
Aeropyrenees,https://linkedin.com/company/aero-pyrenees-maintenance,"AERO PYRENEES MAINTENANCE is an aviation & aerospace company based out of Aéroport Tarbes Lourdes Pyrénées, Juillan, France. Website: https://www.",aeropyrenees,
Aeroregional,https://linkedin.com/company/aeroregional,Página Oficial de Aeroregional Ecuador Somos #TuLíneaAérea ¡YA ESTAMOS VOLANDO! VENTA DE BOLETOS: www.aeroregional.net CALL CENTER: 02 393 0360.,aeroregional,
Aerosafin,https://linkedin.com/company/keyworld-it,"Commercial Director, en AEROSAFIN -… Click here to view Michał Guz's profile. Michał Guz. Junior Java Developer. See all employees. Similar pages. FGM INOX ...",aerosafin,
Aeroservicios de la Costa,https://linkedin.com/company/aerologistica-aviation-services,"Nos especializamos en proporcionar servicios completos de apoyo en tierra para vuelos de pasajeros, ejecutivos y chárter que operan en Costa Rica. Con más de 20 ...",aeroservicios de la costa,
Aerostan,https://linkedin.com/company/aerostan-aircompany,"AeroStan Air Company is an on-demand non-scheduled air cargo airline, which specializes in operating high-density – high-demand wide-body freighter aircrafts.",aerostan,
Aerosucre,https://linkedin.com/company/aerosucre,Aerosucre líder en el transporte de carga aérea con más de 53 años de operación en Colombia y algunos países de Latinoamérica. Su sede central opera en Bogotá ...,aerosucre,
Aerotec,https://linkedin.com/company/aerospace-testing-engineering-&-certification-l-l-c-,"AeroTEC develops, tests and certifies new aircraft products using innovative and scalable development, test and certification techniques.",aerotec,
Aerotours,https://linkedin.com/company/aerotours-gmbh-verkehrspilotenschule,"AEROTOURS GmbH Verkehrspilotenschule is an airlines/aviation company based out of Flugplatzstr. 12, Strausberg, Strausberg, Germany.",aerotours,
Aerotranscargo,https://linkedin.com/company/aerotranscargo,"AeroTransCargo (airline code ATG/F5) is a cargo airline holding a Moldovan AOC, with its operational office based in the UAE. It operates five Boeing 747-400s ...",aerotranscargo,
Aeroturpial,,,aeroturpial,
Aerovias DAP,https://linkedin.com/company/aerov%C3%ADas-dap,"Aerovías DAP | 3582 seguidores en LinkedIn. La Línea Aérea de la Patagonia y Antártica. Empresa líder en logística, transporte de pasajeros y turismo.",aerovias dap,
Aerovis Airlines,https://linkedin.com/company/aerovis,"AeroVis offers aviation, cargo transportation around the world. Rental, sale, charter and aircraft management from Europe, Asia, India, to Australia, South and ...",aerovis airlines,
Aeroways,https://linkedin.com/company/aeroways-gmbh,"aeroways GmbH | 99 Follower:innen auf LinkedIn. High Class Travelling | Your competent partner for aircraft management, sales and operation.",aeroways,
Aerowest,https://linkedin.com/company/aerowest/,"Aerowest GmbH | 491 followers on LinkedIn. HighRes Aerial Images and Geodata | Aerial Imaging, GIS, Digital Mapping, 3D City Models.",aerowest,
Aerus,https://linkedin.com/company/aerus,"Aerus has a rich history dating back to 1924 and is known for excellence in our innovative technologies, unmatched service, and endless accomplishments.",aerus,
Africa Airlines,https://linkedin.com/company/africa-world-airlines-limited,Africa World Airlines Limited (AWA) is a private-sector Ghanaian airline that operates from a base in Accra. The airline is a joint venture between HNA Group/ ...,africa airlines,
Africa Charter Airline,https://linkedin.com/company/alexandria-airlines,"It operates scheduled and worldwide charter services flights, mainly to the Middle East, Europe and Africa. It also provides wet lease services to major ...",africa charter airline,
Africa World Airlines,https://linkedin.com/company/africa-world-airlines-limited,Africa World Airlines Limited (AWA) is a private-sector Ghanaian airline that operates from a base in Accra. The airline is a joint venture between HNA ...,africa world airlines,
African Express Airways,https://linkedin.com/company/african-express-airways,Sito Web: http://www.africanexpress.net. Link esterno per African Express Airways ; Settore: Linee aeree e aviazione ; Dimensioni dell'azienda: 51-200 dipendenti.,african express airways,
Afrijet,https://linkedin.com/company/afrijet-business-service,Afrijet Business Service | 14190 followers on LinkedIn. Le Coeur de l'Afrique vous est ouvert | Afrijet aims to be the Central Africa's reference regional ...,afrijet,
Afriqiyah Airways,https://linkedin.com/company/afriqiyah-airways,Afriqiyah Airways was founded on April 2001. It started its operations on 1st December 2001 with leased Aircrafts. During the Paris Air Show in 2006 ...,afriqiyah airways,
Aims Community College Aviation,https://linkedin.com/company/preflight-aviation-camp,"PreFlight is a summer camp for girls that uses aviation to transform their beliefs about gender roles, increase their self-esteem, and inspire them to become ...",aims community college aviation,
Air 1st Aviation,https://linkedin.com/company/first-class-aviation-services,"First Class Aviation Services (FCAS) is a Saudi Owned Maintenance, Repair and Overhaul organisation, with state-of-the art technology, established to serve ...",air 1st aviation,
Air Adelphi,https://linkedin.com/company/adelphi,"adelphi is the leading independent think-and-do tank in Europe for climate, environment and development. We are some 330 strategists, thought leaders and ...",air adelphi,
Air Albania,https://linkedin.com/company/air-albania,"Air Albania is the national flag carrier airline of Albania, offering Albanians new destinations, reasonable prices and quality service.",air albania,
Air Algerie,https://linkedin.com/company/airalg%C3%A9rie,"Air Algérie is the national airline. Air Algerie has produced an excellent commercial performance, according to the Medium-Term plan, it carries more than five ...",air algerie,
Air Alliance,https://linkedin.com/company/alliance-air,Компания Allaince air успешно работает на рынке дистрибуции промышленного климатического оборудования с 2013 года. Сотрудники компании имеют опыт в HVAC с ...,air alliance,
Air Alsie,https://linkedin.com/company/air-alsie,"Air Alsie A/S provides executive jet services in Scandinavia and internationally. It offers air charter, and aircraft management/advisory and maintenance ...",air alsie,
Air Antilles,https://linkedin.com/company/air-antilles,Air Antilles | 10124 followers on LinkedIn. Au cœur des iles | French Regional Airline IATA CODE: 3S - CALLSIGN: Greenbird Air Antilles operates scheduled ...,air antilles,
Air Arabia,https://linkedin.com/company/air-arabia,"Welcome to Air Arabia Group, the leading low-cost carrier in the Middle East and North Africa. Operating from six key hubs—Sharjah, Ras Al Khaimah, Abu Dhabi, ...",air arabia,
Air Astana,https://linkedin.com/company/air-astana,We are a multi-award-winning international airline. Join us to plan your new adventures around the world from and via Almaty and Astana.,air astana,
Air Astra,https://linkedin.com/company/airastra/,Air Astra (incorporated as Astra Airways Limited) is a privately-held commercial airline that expects to launch commercial flight operations by Q4 2022.,air astra,
Air Atlanta Icelandic,https://linkedin.com/company/air-atlanta,"The Air Atlanta brand consists of two sister airlines, “Air Atlanta Icelandic” with headquarters in Iceland and “Air Atlanta Europe” in Malta.",air atlanta icelandic,
Air Austral,https://linkedin.com/company/air-austral,"AIR AUSTRAL, VOTRE COMPAGNIE PARTENAIRE AU DEPART DE LA REUNION VERS / - L'OCEAN INDIEN DES LIAISONS DIRECTES VERS TOUTES LES ILES DE L'OCEAN INDIEN, COMORES, ...",air austral,
Air Baltic,https://linkedin.com/company/airbaltic,airBaltic is a strong and internationally respected airline with the main hub in Riga and bases in Tallinn and Vilnius. We currently offer flights to nearly ...,air baltic,
Air Bohemia,https://linkedin.com/company/airbohemia,Air Bohemia is a private provider of business air transport. The company was founded in 2012 in the Czech Republic by renaming the former company Aero-taxi OKR ...,air bohemia,
Air Borealis,https://linkedin.com/company/air-borealis,"Air Borealis is an airline all can take great pride in. With deep respect and connection to the community, the environment, and the people of the North.",air borealis,
Air Botswana,https://linkedin.com/company/air-botswana,"Air Botswana is the country's national airline. The airline operates and maintains a fleet of four aircraft, that includes an Embraer 170 Jet, ATR42-500 and ...",air botswana,
Air Burkina,https://linkedin.com/company/air-burkina-s-a-,Air Burkina SA Aviation and Aerospace Component Manufacturing Follow Report this company Close menu View all 69 employees About us,air burkina,
Air Busan,https://linkedin.com/company/airbusan,"AIR BUSAN. Airlines and Aviation. Busan, Gangseo-gu 1,437 followers. New Take-Off 2023. Follow · Report this company; Close menu. View all 95 employees ...",air busan,
Air Cairo,https://linkedin.com/company/air-cairo,"Air Cairo is a low fare airline based in Cairo, Egypt. The airline is the low fare subsidiary of Egyptair which operates scheduled flights to middle east, ...",air cairo,
Air Caledonie,https://linkedin.com/company/air-cal%C3%A9donie,"Air Calédonie est l'unique compagnie aérienne à desservir l'ensemble du réseau domestique de Nouvelle-Calédonie, de façon régulière. Website: http:// ...",air caledonie,
Air Cambodia,https://linkedin.com/company/cambodia-airways,"Cambodia Airways Co., Ltd. is a local Cambodian airline based in Phnom Penh. Established in September 2017, the company launched its inaugural flight on July ...",air cambodia,
Air Canada,https://linkedin.com/company/air-canada,"Canada's largest airline, the country's flag carrier and a founding member of Star Alliance, the world's most comprehensive air ...",air canada,
Air Canada Rouge,https://linkedin.com/company/air-canada-rouge,"As a team, we know that our purpose is to create wonderful beginnings and endings to our travellers' vacations, which we are committed to do every day, on ...",air canada rouge,
Air Caraibes,https://linkedin.com/company/air-caraibes,"Air Caraïbes | Haute en couleurs... ✈ Aujourd'hui reconnue comme la compagnie aérienne antillaise spécialiste des Caraïbes et de la Guyane, (code IATA : TX code ...",air caraibes,
Air Care Alliance,https://linkedin.com/company/air-care-alliance,The Air Care Alliance is a 501(c)(3) nonprofit public service organization representing a nationwide network of volunteer pilot groups that deliver ...,air care alliance,
Air Cargo Carriers,https://linkedin.com/company/air-cargo-carriers,"Air Cargo Carriers provides reliable, scheduled service for the world's largest scheduled freight carriers, as well as full-service, on-demand charters.",air cargo carriers,
Air Central,,,air central,
companies_name,https://linkedin.com/company/techasoft-pvt-ltd,Techasoft Pvt. Ltd is one of the fast growing IT companies that provide a holistic IT solution to businesses across geographies.,companies_name,
Air Century,https://linkedin.com/company/aircentury,Air Century | 4749 followers on LinkedIn. Improving the Experience | Dominican airline with over 30 years of experience serving the greater Caribbean region ...,air century,
Air Changan,https://linkedin.com/company/yaning-purification-technology-co.ltd,"main products 1.FFU ,air shower room ,cargo air shower ,HEPA filter ,horizontal clean bench ,pass box ,clean booth medical bench and so on 2.primer ...",air changan,
Air Charter Scotland,https://linkedin.com/company/air-charter-scotland-ltd/,Air Charter Scotland has earned a reputation as one of the safest and most respected private jet operators. We ensure our fleet is maintained to uncompromising ...,air charter scotland,
Air Charter Scotland Europe,https://linkedin.com/company/air-charter-scotland-europe,Air Charter Scotland has built a reputation as one of the most reliable private jet operators in the UK. We are the preferred private jet operator for some of ...,air charter scotland europe,
Air Charters Europe,https://linkedin.com/company/aircharterseurope,Air Charters Europe (ACE) is part of the ASL Group and focuses on customers who want to charter a (private) aircraft for group travel.,air charters europe,
Air Chathams,https://linkedin.com/company/air-chathams-limited,Air Chathams is a 100% privately owned airline started in 1984 by CEO Craig Emeny. The airline built its foundations providing a critical air-link between the ...,air chathams,
Air China,https://linkedin.com/company/air-china/,"Air China is China's only national flag carrier and a member carrier of the world's largest airline network - Star Alliance. By Jun 2016, Air China had a ...",air china,
Air China Cargo,https://linkedin.com/company/air-china-cargo/,"A cargo airline with its headquarters in Shunyi District, Beijing, China t is an all-cargo subsidiary of Air China and operates services to 36 cities in 27 ...",air china cargo,
Air China Inner Mongolia,https://linkedin.com/company/inner-mongolia-jianlong-biochemical-co--ltd,"Locations. SUITE 701,AIR CHINA PLAZA. NO.96 ZHELIMU ROAD. XINCHENG, XINCHENG 010010, CN. Get directions. Employees at INNER MONGOLIA JIANLONG BIOCHEMICAL CO., ...",air china inner mongolia,
Air Class,https://linkedin.com/company/air-class,"Air Class, founded in Singapore & the UK in 2014, is a global leading 1-on-1 online education enterprise.",air class,
Air Corporate,https://linkedin.com/company/air-corporate,Air Corporate is a Hong Kong-based new generation of Corporate Services Provider using a digital-first approach. Air Corporate offers entrepreneurs a ...,air corporate,
Air Corsica,https://linkedin.com/company/air-corsica,"Air Corsica (code IATA : XK ; code OACI : CCM) est une compagnie aérienne française, précédemment appelée Compagnie Corse Méditerranée puis CCM Airlines.",air corsica,
