company_name,linkedin_url,description,company_name_norm,fleet_size
Pobeda,https://linkedin.com/company/pobedaairlines,"Pobeda Airlines. Airlines and Aviation. Moscow, Moscow 2,263 followers. We are Russia's first lowcost airline. Follow · Report this company; Close menu.",pobeda,
Poland - Air Force,https://linkedin.com/company/polish-air-force,The mission of POL AF is to defend national air space and territory and to participate in allied operations (NATO) out of Poland. The POL AF undergoes ...,poland - air force,
Poland - Navy,https://linkedin.com/company/babcock-international-group,This event provided a valuable opportunity to showcase the achievements of the Polish Navy and highlight the resurgence of Poland's shipbuilding industry.,poland - navy,
Polar Airlines,https://linkedin.com/company/polar-air-cargo,"A modern, all-cargo fleet, coverage of major world markets, vast experience in air cargo and a commitment to quality, safety and customer service.",polar airlines,
Polish Medical Air Rescue,https://linkedin.com/company/medical-rescue,"MEDICAL RESCUE is a specialist pre hospital medical practice and aeromedical services company providing remote medical logistics, remote site services.",polish medical air rescue,
populAir,https://linkedin.com/company/restaurant-populair,About us ; Website: http://www.restaurant-populair.nl. External link for X ; Industry: Restaurants ; Company size: 1 employee ; Type: Public Company ...,populair,
Porsche Air Service,https://linkedin.com/company/gtsairservice,"GTS AIR SERVICE, is a company specialized in representing Airlines as a GSSA and GHA (General Sales and Service Agency). · Report this company · Close menu.",porsche air service,
Porter,https://linkedin.com/company/theporter-in,"With presence in more than 21+ Indian cities and 3 countries, we are making deliveries easy for all. Over a decade, we have completed 20 crores+ ...",porter,
Portugal - Air Force,https://linkedin.com/company/portuguese-air-force,"A Força Aérea Portuguesa foi criada em 1 de Julho de 1952, constituindo-se como ramo independente, em paralelo com o Exército e com a Armada e integrando as ...",portugal - air force,
Poste Air Cargo,https://linkedin.com/company/poste-aircargo,"Le Rotte Poste Air Cargo svolge i propri servizi di trasporto anche per il mercato, volando in Europa, Bacino del Mediterraneo e Asia Occidentale, con soluzioni ...",poste air cargo,
Pouya Air,https://linkedin.com/company/servohydraulic,"SERVOHYD is an approved Iranian company in the field of Commercial Aircraft Maintenance, Repair, And Overhaul (MRO).",pouya air,
Pradhaan Air Express,https://linkedin.com/company/pradhaan-air,"11 pallets, 21 tonnes, endless possibilities. Pradhaan Air Express delivers speed, precision, and efficiency for your cargo needs.",pradhaan air express,
Precision Air,https://linkedin.com/company/precision-air,"Precision Air is the only U.S. healthcare company specializing in improving surgical patient outcomes through customized, zero-particle OR airflow solutions ...",precision air,
Precision Aircraft Management,https://linkedin.com/company/precisionaircraftmanagement,"A Rocky Mountain leader in turnkey private aviation. We provide private aircraft management, charter operations, and aircraft sales and crewing solutions.",precision aircraft management,
Premier Airlines,https://linkedin.com/company/premier-airways-limited,Premier Airways is a Chennai based Public Limited company founded in August 2005 by a group of successful US NRI and Indian Entrepreneurs.,premier airlines,
Premier Flight Center,https://linkedin.com/company/premier-jet-center-kfcm,"Premier Jet Center is a full service FBO offering line services, maintenance, charter services, and aircraft interiors. It has the largest hangar on Flying ...",premier flight center,
Premium Jet,https://linkedin.com/company/premium-jet-ag,We offer aircraft management and charter solutions with complete dedication to service excellence - 365 days a year.,premium jet,
Presidential Aviation,https://linkedin.com/company/flypresidential,"With worldwide operations, Presidential Aviation delivers a consistently high quality, premium jet charter experience. Safety and security are ...",presidential aviation,
Prestige Air Group,https://linkedin.com/company/prestige-air-group,"Prestige Air Group | 295 followers on LinkedIn. FAA Part 91 Private Jet Management, FAA Part 135 Charter Sales, Aircraft Maintenance, UAV Compliance ...",prestige air group,
Priester Aviation,https://linkedin.com/company/priester-aviation,"Priester Aviation, founded in 1945, is among the world's most experienced aircraft management, global jet charter, and consulting companies.",priester aviation,
Prime Aviation,https://linkedin.com/company/primeaviationfzco,"Being a comprehensive cargo solution provider, Prime Aviation now successfully offers numerous aviation services from air cargo charter to scheduled cargo ...",prime aviation,
Prince Aviation,https://linkedin.com/company/prince-aviation,"Prince Aviation is your trusted partner for comprehensive aircraft maintenance, technical and modification solutions. With a dedicated team of highly skilled ...",prince aviation,
Princely Jets,https://linkedin.com/company/princely-jets-private-limited,Princely Jets is Pakistan's first business jet and helicopter operator. We started operations in November 2005 with a single aircraft and now operate a fleet ...,princely jets,
Priority Air Charter,https://linkedin.com/company/priority-air-charter,Priority Air Charter Airlines and Aviation Excellence in On-Demand Air Cargo Service. Follow Report this company Close menu View all 16 employees,priority air charter,
Privaira,https://linkedin.com/company/privaira,Privaira is a private aviation company focused on distinctive individuals and companies who fly private. We provide air charter on our own fleet of aircraft.,privaira,
Private Air,https://linkedin.com/company/private-air,"Private Air has evolved into one of Canada's premier aircraft charter and management companies, serving leading corporations and business leaders.",private air,
Private Jet Center,https://linkedin.com/company/private-jet-center,"Founded in 2003, Private Jet Center, formerly Pittsburgh Jet Center, is an aviation services company and fixed base operator (FBO) with headquarters near ...",private jet center,
Private Jets,https://linkedin.com/company/private-jets-inc,"A most exceptional private travel experience. Our team members are hospitality experts, ready to arrange hotels, transportation and in-flight catering.",private jets,
Private Wings,https://linkedin.com/company/private-wings-flugcharter-gmbh/,"Private Wings Flugcharter GmbH | 2652 followers on LinkedIn. Your Business Airline. Modern aircraft with 32 and 18 seats for corporate, event and sport ...",private wings,
Privilege Style,https://linkedin.com/company/privilege-style/,"Privilege Style is a Spanish private airline operating worldwide. Over the last 15 years we have operated over 70.000 flight hours, landed over 500 airports ...",privilege style,
Priv’Air,https://linkedin.com/company/priv'air,Priv'Air was created to meet the needs of several business leaders and decision-makers who needed to make short and frequent trips throughout Europe.,priv’air,
ProAir Aviation,https://linkedin.com/company/proair-aviation-gmbh,The ProAir Aviation is an independent airline company with a large fleet of aircraft licensed by the German Federal Aviation Authority (LBA).,proair aviation,
ProAirways,https://linkedin.com/company/professional-pilots-aircraft-maintenance,Professional Jet Center Aircraft Maintenance is an FAA certified 145 repair station (ZKFR180L) and the primary aircraft maintenance provider to Pro Airways.,proairways,
Proflight Zambia,https://linkedin.com/company/proflightzambia,"Proflight Zambia was established in 1991 and is Zambia's leading scheduled airline. From its base in Lusaka its domestic routes include, Livingstone, Mfuwe, ...",proflight zambia,
Propair,https://linkedin.com/company/propair-llc,ProPair's machine learning technology enables organizations to optimize their sales performance through automated and predictive lead assignment.,propair,
Purdue University School of Aviation,https://linkedin.com/company/purdueaviationtechnology,"We offer undergraduate majors in Aeronautical Engineering Technology, Aerospace Financial Analysis, Airline Management and Operations, Airport Management and ...",purdue university school of aviation,
QA Aviation,https://linkedin.com/company/queen-air,Queen Air (QA Aviation) | 146 followers on LinkedIn. Queen air is the bussines jets operator and holder of AOC CZ-66 based in Czech Republic.,qa aviation,
Qanot Sharq,https://linkedin.com/company/qanot-sharq-airlines,"Qanot Sharq Airlines is the first and largest private airline in Uzbekistan, committed to delivering exceptional air travel experiences.",qanot sharq,
Qantas,https://linkedin.com/company/qantas,"We are honoured to be named Best Airline in Australia and Pacific at the 2025 Skytrax World Airline Awards, announced at the Paris Air Show.",qantas,
QantasLink,https://linkedin.com/company/qantaslink,"About us. Airline. Industry: Airlines and Aviation. Company size: 1,001-5,000 employees. Headquarters: Sydney, New South Wales. Type: Public Company. Locations.",qantaslink,
Qatar Airways,https://linkedin.com/company/qatar-airways,"Qatar Airways is the national airline of the State of Qatar. Based in Doha, the Airline's trendsetting on-board product focuses on: comfort, fine cuisine.",qatar airways,
Qatar Executive,https://linkedin.com/company/qatar-airways/life/qatarexecutive,Qatar Executive is the corporate jet subsidiary of Qatar Airways Headquartered at Doha International Airport. Our portfolio of luxury jet services includes ...,qatar executive,
Qazaq Air,https://linkedin.com/company/qazaq-air,"Qazaq Air provides affordable regional air travel compliant with the highest global safety standards, creating connectivity which will enhance the economic ...",qazaq air,
Qeshm Airlines,https://linkedin.com/company/qeshm-air,Website: https://www.qeshm-air.com/. External link for Qeshm Air. Industry: Airlines and Aviation. Company size: 201-500 employees. Type: Privately Held ...,qeshm airlines,
QinetiQ / Empire Test Pilots School,https://linkedin.com/company/avalon-aero-ltd,"Luke joined the Avalon Aero team back in 2017 as a Mechanic and since then has been an integral part of the team supporting the ""Empire Test Pilots School"" ...",qinetiq / empire test pilots school,
Qingdao Airlines,https://linkedin.com/company/qingdao-airlines,Qingdao Airlines is mainly engaged in domestic and international air passenger and cargo transportation and related businesses. It was approved by the Civil ...,qingdao airlines,
companies_name,https://linkedin.com/company/compoundcontent,We help B2B companies generate demand with organic social. Join our waitlist. https://www.compoundcontentstudio.com/,companies_name,
Quality Fly,https://linkedin.com/company/global-training-aviation,"With over 20 years of experience operating full flight simulators, we are committed to providing high-quality training solutions at the best value. At GTA, we ...",quality fly,
Quanta Aviation Services,https://linkedin.com/company/quanta-aviation-services,"The goal of Quanta Aviation Services is to provide a central organization to manage, coordinate and serve all Quanta aviation operations.",quanta aviation services,
Quest Diagnostics,https://linkedin.com/company/quest-diagnostics,Quest Diagnostics (NYSE: DGX) empowers people to take action to improve health outcomes. Derived from the world's largest database of clinical lab results.,quest diagnostics,
Quick Air Jet Charter,https://linkedin.com/company/quick-air-jet-charter-gmbh,Worldwide Fixed Wing Air Ambulance Provider with capabilities to provide advanced life support. Specialised in adult intensive care transportation.,quick air jet charter,
Quikjet Cargo Airlines,https://linkedin.com/company/quikjet-cargo-airline,"Quikjet is a cargo airline, based in India, catering to the growing Air cargo demand in the country and the subcontinent. The company was promoted by AFL.",quikjet cargo airlines,
RAF-Avia,https://linkedin.com/company/raf-avia,RAF-Avia is the leading cargo carrier in Baltics established in 1990. We operate regular and ad hoc charter flights in the region and all over the Europe.,raf-avia,
Raimon Airways,https://linkedin.com/company/raimon-airways,"Raimon Airways is a newly established Iranian carrier, dedicated to providing safe, reliable, and thoughtful air travel across the region.",raimon airways,
Rainier Flight Service,https://linkedin.com/company/rainier-flight-service,Rainier Flight Service provides career and leisure flight training with a simple mission: To spread a passion for aviation through the best service at the best ...,rainier flight service,
Rano Air,https://linkedin.com/company/rano-air-limited,"Rano Air Limited is one of the leading domestic airline companies in Nigeria, offering affordable, efficient and reliable services to the air travelling ...",rano air,
Ravenair,https://linkedin.com/company/ravenair,Diverse General & Business Aviation Company based at Liverpool John Lennon Airport. Full Fixed Base Operator (FBO). Your first choice at Liverpool John Lennon ...,ravenair,
Raya Airways,https://linkedin.com/company/rayaairways/,"Raya Airways, a Malaysian scheduled all-cargo airline specialises in express freight and air freighter charter servicing domestic, South East Asian and North ...",raya airways,
RCS Services,https://linkedin.com/company/rcs-services,"Founded in 1990, RCS Services, Inc. is a full service risk control, loss prevention, and insurance advisory firm specializing in providing a wide range of loss ...",rcs services,
REACH Air Medical Services,https://linkedin.com/company/reach-air-medical-services,"We provide emergency services, patient relocation services, and search and rescue missions, via air & ground transports.",reach air medical services,
Real Tonga Airline,https://linkedin.com/company/air-chathams-limited,Air Chathams is a 100% privately owned airline started in 1984 by CEO Craig Emeny. The airline built its foundations providing a critical air-link between ...,real tonga airline,
Rectimo Air Transports,https://linkedin.com/company/rectimo-air-transports,Sobre nosotros ; Sitio web: http://www.rectimo.com. Enlace externo para Rectimo Air Transports ; Sector: Fabricación de componentes aeroespaciales y de aviación.,rectimo air transports,
RED Air,https://linkedin.com/company/red-air-defense,"Red Air is an FPV kinetic strike force based in Perth, specialising in countering, challenging drone defence systems and red teaming.",red air,
Red Rock Flight School,https://linkedin.com/company/red-rock-flight-school,"Red Rock Flight School is a family-owned and operated Part 61 flight school located at Falcon Field Airport in Mesa, Arizona.",red rock flight school,
Red Sea Airlines,https://linkedin.com/company/red-sea-airlines/,Red Sea Airlines is newest airlines established in Egypt in 2021. Safety and security is priority number one for us. We operate scheduled and charter flights ...,red sea airlines,
Red Wing Aviation,https://linkedin.com/company/redwingaviation,"Red Wing Aviation is one of the largest North American private aviation operators, with over 30 years of operational expertise.",red wing aviation,
Red Wings,https://linkedin.com/company/detroit-red-wings,Detroit Red Wings | 28198 followers on LinkedIn. Official LinkedIn home of the 11x Stanley Cup Champion Detroit Red Wings • #LGRW | The Detroit Red Wings ...,red wings,
Redding Aero Enterprises,https://linkedin.com/company/northgate-aviation,"We are located centrally at KCIC, offering travelers a premier experience just minutes away from CSU Chico, Sierra Nevada Brewery, and many other local ...",redding aero enterprises,
Redstar Aviation,https://linkedin.com/company/redstar-aviation,"Redstar's core business is to provide Air Ambulance services, the past 33 years have seen Redstar excel in a wide spectrum of services, helping to develop ...",redstar aviation,
Reeve Air Alaska,https://linkedin.com/company/kenaiaviation,"We operate daily scheduled flights between Kenai & Anchorage, scenic tours all over the peninsula, and charter services all over the State of Alaska.",reeve air alaska,
REGA Swiss Air-Ambulance,https://linkedin.com/company/rega/,"Swiss Air-Rescue Rega provides an around-the-clock service offering swift, expert assistance by air. In particular, we transport medical care to the ...",rega swiss air-ambulance,
REGA Swiss Air-Rescue,https://linkedin.com/company/rega/,"Swiss Air-Rescue Rega provides an around-the-clock service offering swift, expert assistance by air. In particular, we transport medical care to the ...",rega swiss air-rescue,
Regency Air,https://linkedin.com/company/regency-air-llc,"Regency Air, LLC | 188 followers on LinkedIn. As a premiere private charter company, Regency Air offers the highest version of elegance, class, ...",regency air,
Reliant Air,https://linkedin.com/company/reliant-air,"Reliant Air is an aviation & aerospace company based out of 1 Wibling Rd, Danbury, CT, United States. Reliant Air Charter includes a fleet of Cessna Citations ...",reliant air,
Renegade Air,https://linkedin.com/company/renegade-air,Renegade Air is a low-cost high energy customer-oriented organization that was founded in 2012. We offer safe and affordable travel at your convenience.,renegade air,
Rennia Aviation,https://linkedin.com/company/rennia-aviation,Rennia Aviation is your premier private jet charter company that is redefining the air charter service industry for the better.,rennia aviation,
Republic Airways,https://linkedin.com/company/republic-airways,"Republic Airways is a regional airline headquartered in Indianapolis, operating fixed-fee flights under our major airline partner brands of American Eagle, ...",republic airways,
REVA Air Ambulance,https://linkedin.com/company/reva-air-ambulance,"REVA-operated jets transport ill or injured patients almost anywhere in the world. REVA works with insurance and travel assistance companies, as well as ...",reva air ambulance,
Revv Aviation,https://linkedin.com/company/flyrevv,"We offer the complete range of aviation services – from flight lessons (whether as a hobby or as training to become a professional pilot), to plane maintenance ...",revv aviation,
rex. Regional Express,https://linkedin.com/company/rex-airlines,"Rex Airlines is Australia's largest independent regional airline. Rex is Australia's most reliable domestic carrier, operating a fleet of Saab 340 aircraft to ...",rex. regional express,
Reynolds Jet,https://linkedin.com/company/reynolds-jet,"Reynolds Jet, headquartered in Cincinnati, Ohio, has been providing personalized aircraft management and on-demand charter solutions since 2008.",reynolds jet,
RGA-Black Stone Airlines,https://linkedin.com/company/rga-black-stone-airlines,"RGA-Black Stone Airlines as the newest key player within the Indonesian air cargo market, servicing routes both across Indonesia and internationally.",rga-black stone airlines,
Richland Aviation,https://linkedin.com/company/richland-aviation-inc,"We believe that hard work, honesty and a sense of place are essential to our particular brand of Montana hospitality. Website: https://richlandaviation.com.",richland aviation,
Richmor Aviation,https://linkedin.com/company/richmor-aviation-inc.,Since 1967! Richmor Aviation is a privately owned Luxury Jet Charter Service provider serving any airport in the World from our headquarters in New York's ...,richmor aviation,
Rimbun Air,https://linkedin.com/company/pt-rimbun-abadi-aviasi,"✈️ Charter Flight Milestone! On 24th May, Rimbun Air proudly commenced our charter flight operations using the ATR 72-600 for a valued client in the oil and gas ...",rimbun air,
RiseAir,https://linkedin.com/company/riseair,"It stands as one of Canada's largest independent air carriers, boasting the most diverse and comprehensive fleet of fixed-wing aircraft in Saskatchewan.",riseair,
Riyadh Air,https://linkedin.com/company/riyadhair,"As a digitally native airline based in Riyadh, we harness innovation and cutting-edge technology to enhance every journey. With the ambition to ...",riyadh air,
Romania - Air Force,https://linkedin.com/company/romanian-air-force,Romanian Air Force · Airlines and Aviation · About us · Employees at Romanian Air Force · Similar pages · Browse jobs · Sign in to see who you already know at ...,romania - air force,
Roraima Airways,https://linkedin.com/company/roraima-group-of-companies-%E2%80%93-roraima-airways,"Chief Executive Officer. Click here to view Gerry Gouveia's profile. Gerry Gouveia. Owner, Roraima Airways.",roraima airways,
Rossiya,https://linkedin.com/company/rossiya-airlines,"Rossiya Airlines Joint Stock Company is a world-famous airline with rich history, leader in flight safety, punctuality and quality of services.",rossiya,
Rotana Jet,https://linkedin.com/company/rotana-jet,"Rotana Jet operates both Executive Charter and Scheduled Airline Services. With its main operating base at Al Bateen Airport, situated only 10km from the City ...",rotana jet,
Royal Air Freight,https://linkedin.com/company/royal-air-freight,"Royal Air Freight owns, maintains, and operates over 40 aircraft. We offer expedited freight shipping services across the United States, Canada, and Mexico.",royal air freight,
Royal Air Maroc,https://linkedin.com/company/royal-air-maroc/,Royal Air Maroc is the national airline of the Kingdom of Morocco and play the major role as the flagship of the national flag abroad.,royal air maroc,
Royal Brunei Airlines,https://linkedin.com/company/royal-brunei-airlines,Royal Brunei Airlines Sdn Bhd (RB) is based in the sultanate of Brunei Darussalam as the country's flag carrier. It is a government owned company operating ...,royal brunei airlines,
Royal Jet,https://linkedin.com/company/royaljetgroup/,The RoyalJet LLC is an Abu Dhabi Emirates affiliated company which leads the global premium private aviation sector.,royal jet,
Royal Jordanian,https://linkedin.com/company/royal-jordanian,Royal Jordanian was established on 15/12/1963 by a Royal Decree as the national carrier of the Hashemite Kingdom of Jordan.,royal jordanian,
Royal Star Aviation,https://linkedin.com/company/royalstar,Royal-Star | 316 followers on LinkedIn. High performance aviation services | ROYAL-STAR has been operating on Polish market since 1995.,royal star aviation,
Royalair Philippines,https://linkedin.com/company/royalairphilippines,"Royal Air Philippines is a Philippine-based airline established in 2002. Serving as an air charter service for almost two decades, Royal Air entered into ...",royalair philippines,
RS Avia,https://linkedin.com/company/aviainternational,"In 1927, several independent petroleum importers in Switzerland joined forces under the name of AVIA. Following the motto: ""Together we are stronger"".",rs avia,
Rubystar,https://linkedin.com/company/ruby-star-traders,"Ruby Star Traders | 79 followers on LinkedIn. Ruby Star Traders is Australia's best loved importer of Indian textiles, furniture and homewares.",rubystar,
Ruili Airlines,https://linkedin.com/company/ruili-airlines-co-ltd,Ruili Airlines is a Chinese full service carrier based at Kunming Changshui International Airport. Ruili Airlines provides Domestic and International flight ...,ruili airlines,
RusJet,https://linkedin.com/company/rusjet,Employees at RusJet · Ekaterina Sugak · Dmitry Shnypko · Елена Грибкова · Evgeny Vorobyev. Key Account Sales Manager – RUSJET · See all employees. Similar pages ...,rusjet,
Rusline,https://linkedin.com/company/aviation-company-rusline,"RusLine Airlines is a 100% privately owned regional airline based in Moscow operating scheduled, charter and ad-hoc VIP flights.",rusline,
Russia - 223rd Flight Unit State Airline,,,russia - 223rd flight unit state airline,
Russia - 224th Flight Unit State Airline,https://linkedin.com/company/swissport,Globally trusted to keep airports running and airlines flying. Proudly leading the way in airport ground services and air cargo handling.,russia - 224th flight unit state airline,
Russia - Air Force,https://linkedin.com/company/the-air-force-culture-and-language-center,"The Air Force Culture and Language Center creates language, region and cultural learning programs for Total Force Airmen.",russia - air force,
Russia - Ministry of Emergency Situations (MChS),https://linkedin.com/company/aardvark-llp,"We specialize in the comprehensive integration of unmanned technologies, providing optimal solutions for various industries, including construction, ...",russia - ministry of emergency situations (mchs),
Russia - National Guard,https://linkedin.com/company/ministry-of-national-guard-development-program-%D8%A8%D8%B1%D9%86%D8%A7%D9%85%D8%AC-%D8%AA%D8%B7%D9%88%D9%8A%D8%B1-%D9%88%D8%B2%D8%A7%D8%B1%D8%A9-%D8%A7%D9%84%D8%AD%D8%B1%D8%B3-%D8%A7%D9%84%D9%88%D8%B7%D9%86%D9%8A,The Ministry of National Guard Development Program (MNGDP) is responsible for developing and overseeing the transformation process in the Ministry through ...,russia - national guard,
Russia - Special Flight Squadron,https://linkedin.com/company/royalnavy,"At sea, on land and in the air. The Royal Navy is made up of five arms. The might of ships in the Surface Fleet, the aerial strength that is the Fleet Air ...",russia - special flight squadron,
Rutaca Airlines,https://linkedin.com/company/rutaca-airlines,"Rutas Aereas C.A. RUTACA, busca brindarles a todos nuestros clientes, nacionales e internacionales un servicio con los más altos estándares de seguridad y ...",rutaca airlines,
